{
  "$schema": "./schemas/goal.schema.json",
  "version": 2,
  "id": "crowntrail-web-slice",
  "title": "Premium Desktop Web Vertical Slice",
  "objective": "Deliver a polished 50-70 minute action-platformer vertical slice playable in modern desktop browsers.",
  "status": "UNPROVEN",
  "delivery_target": {
    "store": "Desktop Web (Chrome/Edge)",
    "platform": "Browser",
    "input": ["Keyboard", "Gamepad"],
    "target_audience": "Mid-difficulty action platformer players",
    "estimated_playtime_minutes": "50-70"
  },
  "experience_contract": {
    "core_mechanic": "Crown Rush v2 (Dash, Charge, Trail, Encounter)",
    "handcrafted_world": "Goldenwind Forest (Stage 1 & 2)",
    "boss_fight_and_ending": "Broken Throne Boss Fight & Ending",
    "save_system": "Local Storage Stage & Progress Retention"
  },
  "acceptance_authority": {
    "user_acceptance_required": true,
    "automated_test_authority": "Verification and correctness"
  },
  "truth_policy": {
    "allowed_evidence_statuses": ["PASS", "FAIL", "UNKNOWN"],
    "no_evidence_status": "UNKNOWN",
    "self_review_can_complete_goal": false,
    "all_required_gates_must_pass": true
  }
}
